Claim,Source Name,Source URL,Verdict,Review Publication Date,Image URL,Tags
Adélio Bispo esteve na Câmara dos Deputados na data do atentado contra Jair Bolsonaro,Estadão,https://www.estadao.com.br/estadao-verifica/adelio-bispo-esteve-na-camara-deputados-volta-circular/,Falso,2026-05-29 07:00:00,https://encrypted-tbn3.gstatic.com/images?q=tbn:ANd9GcRp_oQmEHdLX7bVN00WdpT_zDGh6QNJO6gYHQvpcFKzHcWULhvu,"['Adélio Bispo', 'Câmara dos Deputados, Brasil', 'Deputado', 'Jair Bolsonaro', 'Atentado contra Jair Bolsonaro']"
Jair Bolsonaro foi absolvido de todas as acusações em maio de 2026,AFP Checamos,https://checamos.afp.com/doc.afp.com.B47Q79E,Falso,2026-05-27 07:00:00,https://encrypted-tbn2.gstatic.com/images?q=tbn:ANd9GcQxhYBJ7ZtY3siynPl1NGaZNBssYC4hm9HjkL4uCdVv0uzEpABb,"['Jair Bolsonaro', '2026', 'Absolvição', 'Maio']"
Bolsonaro pede divórcio após suposto envolvimento de Michelle Bolsonaro com o banqueiro Daniel Vorcaro,BOL - UOL,https://www.bol.uol.com.br/noticias/2026/05/22/falso-divorcio-jair-michelle-bolsonaro-daniel-vorcaro.ghtm,Falso,2026-05-22 07:00:00,https://encrypted-tbn3.gstatic.com/images?q=tbn:ANd9GcTxfrYqOoKRflsjLuw4JUSD2z0-pvSaQrIzH0R9UPfMq-0iVYcj,"['Michelle Bolsonaro', 'Daniel Vorcaro', 'Jair Bolsonaro', 'Divórcio']"
Silas Malafaia detona e mostra que já soltou a mão de Flávio Bolsonaro,BOL - UOL,https://www.bol.uol.com.br/noticias/2026/05/21/enganoso-video-silas-malafaia-critica-flavio-bolsonaro-filme.amp.htm,Distorcido,2026-05-21 07:00:00,https://encrypted-tbn1.gstatic.com/images?q=tbn:ANd9GcR-tBIldDAQaV9pl4EA-yQyY5OeJYk2Fwt6X7tXGm4_Ji6DPBK-,"['Silas Malafaia', 'Flávio Bolsonaro', 'Jair Bolsonaro']"
Intercept pediu desculpas e disse não ter provas para reportagem sobre cinebiografia de Jair Bolsonaro,Estadão,https://www.estadao.com.br/estadao-verifica/e-falso-que-intercept-tenha-pedido-desculpas-por-reportagem-sobre-cinebiografia-de-bolsonaro/,Falso,2026-05-21 07:00:00,https://encrypted-tbn0.gstatic.com/images?q=tbn:ANd9GcSCsmiqCeZNNmwXoYs2nzaNcFj0Yx7k2012CjN_EQB2uCER3ijY,"['Jair Bolsonaro', 'The Intercept', 'Reportagem', 'Biográfico']"
"Tema musical do filme sobre Jair Bolsonaro, está sendo uma das mais tocadas nos Estados Unidos",UOL Notícias,https://noticias.uol.com.br/confere/ultimas-noticias/2026/05/20/falso-musica-tema-filme-bolsonaro-mais-tocadas-eua.ghtm,Falso,2026-05-20 07:00:00,https://encrypted-tbn3.gstatic.com/images?q=tbn:ANd9GcSrVKX0TrHUEmFHS98yjQC8lP9VG4VDGJeYnK_Bsuc48oOsu2O0,"['Jair Bolsonaro', 'Música-tema', 'Música', 'Estados Unidos', 'Filme']"
"""AQUI É BOLSONARO!"" Foi com essa frase, aos gritos de uma multidão em Copacabana, que Shakira teria protagonizado um dos momentos mais explosivos da história dos shows no Brasil. Enquanto a plateia ia ao delírio, bastidores ferviam com tentativas de interrupção e revolta de setores da mídia.",Observador,https://observador.pt/factchecks/fact-check-shakira-declara-apoio-a-bolsonaro-em-concerto-em-copacabana/,Errado,2026-05-20 07:00:00,https://encrypted-tbn0.gstatic.com/images?q=tbn:ANd9GcR4BmXfQ1bI3cc97uLr0fVhytjccNsiqGkkw9VN7aT9f_giHA9k,"['Shakira', 'Jair Bolsonaro', 'Espetáculo', 'Copacabana', 'Brasil', 'Eduardo Bolsonaro', 'Inteligência artificial']"
Nunes Marques tornou Bolsonaro elegível novamente,Aos Fatos,https://www.aosfatos.org/noticias/nunes-marques-bolsonaro-elegivel/,falso,2026-05-19 07:00:00,https://encrypted-tbn2.gstatic.com/images?q=tbn:ANd9GcSFEny-cIwYUbTn8LCeERh4iUUid7vn9hZ9BT1Pn3vjAiquyCym,"['Nunes Marques', 'Jair Bolsonaro']"
The Intercept Brasil pediu desculpas e disse não ter provas que liguem família Bolsonaro ao caso Master,Aos Fatos,https://www.aosfatos.org/noticias/intercept-provas-vorcaro-filme-bolsonaro/,falso,2026-05-18 07:00:00,https://encrypted-tbn0.gstatic.com/images?q=tbn:ANd9GcRO_x9FzloaA8VpugjC5E80NEMKIxKcoX02dbETKdpP75oH4UqV,"['Jair Bolsonaro', 'The Intercept', 'Brasil', 'Prova']"
Vídeo mostra Bolsonaro ‘embolsando’ objeto dourado,Aos Fatos,https://www.aosfatos.org/noticias/bolsonaro-roubando-moeda-ouro/,falso,2026-05-15 07:00:00,https://encrypted-tbn1.gstatic.com/images?q=tbn:ANd9GcTO1H1GJ5yTFS1hC4u7hcCioq-RkS5IuBdLEF8EOXPVT7bytv0p,"['Jair Bolsonaro', 'Vídeo', 'Dourado', 'Objeto']"
Intercept admite não ter provas do pagamento do valor para o filme de Bolsonaro,UOL Notícias,https://noticias.uol.com.br/confere/ultimas-noticias/2026/05/15/falso-intercept-admitiu-nao-provas-flavio-bolsonaro-vorcaro.ghtm,Falso,2026-05-15 07:00:00,https://encrypted-tbn0.gstatic.com/images?q=tbn:ANd9GcQ76Aay9nuhAJ3E9q97-hA_83BujujDUk7PmGVGZ0IlgxG1EMcg,"['The Intercept', 'Jair Bolsonaro', 'Filme', 'Pagamento']"
Zico critica Bolsonaro em entrevista,AFP Checamos,https://checamos.afp.com/doc.afp.com.B2VD69K,Falso,2026-05-14 07:00:00,https://encrypted-tbn3.gstatic.com/images?q=tbn:ANd9GcTbEJ5tcfd-K2Dp3nqpLEnX2YPFtQPyn8Z4jiP6ny_6JUMp_QHQ,"['Zico', 'Jair Bolsonaro', 'Entrevista']"
"A Anvisa mandou recolher produtos da marca Ypê com base em acusações sem provas e por motivação política, já que diretores da empresa doaram R$ 1 milhão para a campanha de Jair Bolsonaro em 2022.",Estadão,https://www.estadao.com.br/estadao-verifica/videos-enganam-motivacao-politica-inspecao-anvisa-fabrica-ype/,Enganoso,2026-05-12 07:00:00,https://encrypted-tbn1.gstatic.com/images?q=tbn:ANd9GcQgCNawJuViobbkNsokasJI6_1fa8KD3Mv1oa9nzcBL8lum7utz,"['Ypê', 'Anvisa', 'Agência Nacional de Vigilância Sanitária', 'Produto', 'Jair Bolsonaro', 'Empresa', '2022', 'Político', 'Motivação']"
Bolsonaro deixa hospital com gritos de 'Força Bolsonaro' e 'mito',AFP Checamos,https://checamos.afp.com/doc.afp.com.B2HX2NQ,Enganoso,2026-05-11 07:00:00,https://encrypted-tbn3.gstatic.com/images?q=tbn:ANd9GcTXjl1Mu-639hor2XbFrV5AIEr-RnZUhYoJlEfPI1NrSBu2u3-D,"['Jair Bolsonaro', 'Hospital']"
FBI pediu prisão de Flávio Bolsonaro,Aos Fatos,https://www.aosfatos.org/noticias/fbi-prisao-flavio-bolsonaro/,falso,2026-06-02 20:03:45,,"['Flávio Bolsonaro', 'Federal Bureau of Investigation', 'Prisão']"
Deu ruim! Moraes vai para cima e manda PF prender Flávio e Eduardo Bolsonaro após encontro com Trump,UOL Notícias,https://noticias.uol.com.br/confere/ultimas-noticias/2026/06/02/falso-moraes-mandado-prisao-flavio-eduardo-bolsonaro.ghtm,Falso,2026-06-02 17:40:53,https://encrypted-tbn1.gstatic.com/images?q=tbn:ANd9GcSgfY9BC1AOgHVU9Usir4wPZ9RLgZ17MvhpbujcHiJQgJW5654s,"['Alexandre de Moraes', 'Flávio Bolsonaro', 'Eduardo Bolsonaro', 'Donald Trump', 'Polícia Federal', 'Departamento de Polícia Federal']"
PF concluiu investigação sobre pedido de dinheiro feito por Flávio Bolsonaro a Daniel Vorcaro,Estadão,https://www.estadao.com.br/estadao-verifica/falso-pf-conclui-investigacao-mensagens-flavio-bolsonaro-vorcaro/,Falso,2026-06-02 16:38:03,https://encrypted-tbn0.gstatic.com/images?q=tbn:ANd9GcRaYJh5t4fpeTRYmTLtDfck1ilGrsLtt2JMJpsppigfvcWoWLXJ,"['Flávio Bolsonaro', 'Daniel Vorcaro', 'Departamento de Polícia Federal', 'Polícia Federal', 'Pesquisa', 'Dinheiro']"
Casa Branca desmente encontro entre Flávio Bolsonaro com Donald Trump,UOL Notícias,https://noticias.uol.com.br/confere/ultimas-noticias/2026/06/01/falso-casa-branca-desmente-reuniao-donald-trump-flavio-bolsonaro.ghtm,Falso,2026-06-01 19:15:55,https://encrypted-tbn2.gstatic.com/images?q=tbn:ANd9GcSp5-iy4biHeCQ1BMoJgzGtv7JcksrOjh1NEA1_uEEMoRJv_Fvw,"['Flávio Bolsonaro', 'Donald Trump', 'Casa Branca']"
Lula foge do palácio aos gritos de volta Bolsonaro,UOL Notícias,https://noticias.uol.com.br/confere/ultimas-noticias/2026/05/07/lula-nao-saiu-do-palco-apos-gritos-pro-bolsonaro-audio-e-manipulado.ghtm,Falso,2026-05-07 07:00:00,https://encrypted-tbn2.gstatic.com/images?q=tbn:ANd9GcRZ6abGEWUU4Cgqwoa6JezPMJHI8r7f2jet680s5S2ivqVkFOT8,"['Luiz Inácio Lula da Silva', 'Jair Bolsonaro']"
Shakira delcarou apoio a Flávio e a Jair Bolsonaro durante show em Copacabana,AFP Checamos,https://checamos.afp.com/doc.afp.com.B22G4WE,Falso,2026-05-06 07:00:00,https://encrypted-tbn1.gstatic.com/images?q=tbn:ANd9GcSxqQiuqnNWEFs9PZHc-H-trjN_HPWwT6nofYZ9F6ccCOCYBrE_,"['Shakira', 'Jair Bolsonaro', 'Flávio Bolsonaro', 'Espetáculo', 'Copacabana']"
Jair Renan filho de Bolsonaro é alvo de operação policial em 2026,AFP Checamos,https://checamos.afp.com/doc.afp.com.A9ZT363,Enganoso,2026-05-06 07:00:00,https://encrypted-tbn2.gstatic.com/images?q=tbn:ANd9GcQqK530FmiITbKQu_yj6HsGFyzmjK_cbh-azDGKyzfhptCGEd0R,"['Jair Renan Bolsonaro', 'Jair Bolsonaro', '2026', 'Polícia']"
"Shakira declarou apoio a Bolsonaro durante show em Copacabana, no Rio",BOL - UOL,https://www.bol.uol.com.br/noticias/2026/05/05/shakira-nao-deu-declaracao-de-apoio-a-bolsonaro-video-e-ia.ghtm,Falso,2026-05-05 07:00:00,https://encrypted-tbn0.gstatic.com/images?q=tbn:ANd9GcTidDxHHXqMpqFLQJmRIqrqNnrt-U6_PRuRDlezwEjGdIFYbgfm,"['Jair Bolsonaro', 'Shakira', 'Rio de Janeiro', 'Copacabana']"
"""URGENTE - Flávio Bolsonaro vai acabar com o Bolsa Família de R$ 600,00 e poderá retornar com Auxílio Brasil de R$ 1.200,00 para famílias carentes caso seja eleito Presidente do Brasil""",UOL Notícias,https://noticias.uol.com.br/confere/ultimas-noticias/2026/05/28/falso-flavio-bolsonaro-promessa-bolsa-familia-troca-auxilio-brasil.ghtm,Falso,2026-05-28 17:20:26,https://encrypted-tbn3.gstatic.com/images?q=tbn:ANd9GcS-sjMJAOGoPePiSwTGxFA1WuWMDKYs3ipU6bexi86p039-Qun-,"['Bolsa Família', 'Flávio Bolsonaro', 'Auxílio Brasil', 'Presidente do Brasil', 'Presidente', 'Brasil', 'Eleição']"
Shakira declarou apoio a Jair Bolsonaro durante show em Copacabana,Aos Fatos,https://www.aosfatos.org/noticias/shakira-lula-bolsonaro-show-brasil/,falso,2026-05-04 07:00:00,https://encrypted-tbn0.gstatic.com/images?q=tbn:ANd9GcS4WqwPPD1Q5Ioa2y6ehyV3nk9vnuJVjFfRTPfYnb7LQhKBzK-f,"['Jair Bolsonaro', 'Shakira', 'Espetáculo', 'Copacabana']"
Fotos publicadas por Flávio sobre o encontro com Trump foram geradas por IA,Aos Fatos,https://www.aosfatos.org/noticias/fotos-trump-flavio-bolsonaro/,falso,2026-05-28 05:07:38,https://encrypted-tbn3.gstatic.com/images?q=tbn:ANd9GcT7s9jrPspV4KVRZ3XgVxOi44SHcHK0hnG2tD8yt6LCNrRqLj1i,"['Flávio Bolsonaro', 'Donald Trump', 'Inteligência artificial', 'Fotografia']"
Fotos mostram Flávio e Eduardo Bolsonaro conversando com Trump no Salão Oval,Aos Fatos,https://www.aosfatos.org/noticias/flavio-bolsonaro-trump-ia/,falso,2026-05-28 05:07:38,https://encrypted-tbn2.gstatic.com/images?q=tbn:ANd9GcRqcVgSN1srwz39q4-w6xxHj4BDwy09dgxeUrLbahr0QoygtI84,"['Flávio Bolsonaro', 'Donald Trump', 'Eduardo Bolsonaro', 'Fotografia', 'Salão Oval']"
Fotos mostram Flávio Bolsonaro entregando camisa da seleção a Trump,Aos Fatos,https://www.aosfatos.org/noticias/flavio-bolsonaro-trump-ia/,falso,2026-05-28 05:07:38,https://encrypted-tbn2.gstatic.com/images?q=tbn:ANd9GcRqcVgSN1srwz39q4-w6xxHj4BDwy09dgxeUrLbahr0QoygtI84,"['Flávio Bolsonaro', 'Donald Trump', 'Fotografia', 'Camisa']"
Foto de Flávio Bolsonaro ao lado de Donald Trump na Casa Branca em maio de 2026,UOL Notícias,https://noticias.uol.com.br/confere/ultimas-noticias/2026/05/27/foto-flavio-bolsonaro-donald-trump-sem-indicios-de-ia.ghtm,Verdadeiro,2026-05-27 19:01:31,https://encrypted-tbn3.gstatic.com/images?q=tbn:ANd9GcTbIhHyu18a39538sYXToAb_jw1QJcpG7CPoe7Rm38X3Eehw0tM,"['Flávio Bolsonaro', 'Donald Trump', 'Fotografia', 'Casa Branca', 'Maio', '2026']"
URGENTE: Vaza primeiras imagens da reunião entre Donald Trump e Flávio Bolsonaro. E a esquerda entra em desespero,UOL Notícias,https://noticias.uol.com.br/confere/ultimas-noticias/2026/05/27/falso-imagem-reuniao-donald-trump-flavio-bolsonaro-ia.ghtm,Falso,2026-05-27 18:33:28,https://encrypted-tbn2.gstatic.com/images?q=tbn:ANd9GcR_EFRFq9mLimVYuiN_6C5XEkt2GPZ23w_p_Wkj7MJp40tAoJqd,"['Flávio Bolsonaro', 'Donald Trump', 'Imagem', 'Reunião', 'Esquerda']"
Polícia Federal confirma: Bolsonaro nunca usou cartão corporativo da Presidência,UOL Notícias,https://noticias.uol.com.br/confere/ultimas-noticias/2026/05/03/pf-nao-disse-que-bolsonaro-nao-usou-cartao-corporativo-durante-mandato.ghtm,Falso,2026-05-03 07:00:00,https://encrypted-tbn0.gstatic.com/images?q=tbn:ANd9GcQSzQkWh3Wqq4z409RkmRG15dp-LWYXJdzq06BbD7Ze5h8rArvy,"['Jair Bolsonaro', 'Polícia Federal', 'Departamento de Polícia Federal', 'Cartão de visita', 'Papel cartão', 'Polícia', 'Presidente do Brasil']"
Vaza conversas íntimas de Michelle Bolsonaro e Daniel Vorcaro,Estadão,https://www.estadao.com.br/estadao-verifica/michelle-bolsonaro-affair-vorcaro-ataque-genero/,Falso,2026-05-26 15:22:00,https://encrypted-tbn0.gstatic.com/images?q=tbn:ANd9GcQ2LDid02dkKePqA8RpTa6cAvkSO_MXH6I08KO5tKvKa_SiFe6W,"['Michelle Bolsonaro', 'Daniel Vorcaro']"
Daniel Vorcaro delatou à Polícia Federal participação de Lulinha e de Moraes em atentado a Bolsonaro,AFP Checamos,https://checamos.afp.com/doc.afp.com.A9HU89E,Falso,2026-04-30 07:00:00,https://encrypted-tbn1.gstatic.com/images?q=tbn:ANd9GcSeOq3yZEWkg-Ld2RIK6Ujl-vRvwfzBPN1kWFIF0LNN9BIrZ4mb,"['Daniel Vorcaro', 'Fábio Luís Lula da Silva', 'Alexandre de Moraes', 'Jair Bolsonaro', 'Departamento de Polícia Federal', 'Polícia Federal', 'Polícia']"
Vorcaro revelou participação de Lulinha e Moraes em atentado a faca contra Bolsonaro,Estadão,https://www.estadao.com.br/estadao-verifica/falso-daniel-vorcaro-revelacoes-sobre-adelio-bispo/,Falso,2026-04-30 07:00:00,https://encrypted-tbn2.gstatic.com/images?q=tbn:ANd9GcQU8dPBdaZyDdH2FqeqShXaQ7e0aA4EG6H9N9E5ooN0I2_aGr6O,"['Daniel Vorcaro', 'Jair Bolsonaro', 'Fábio Luís Lula da Silva', 'Alexandre de Moraes', 'Faca']"
Daniel Vorcaro entregou em delação quem foi responsável pelo atentado contra Bolsonaro em 2018,Aos Fatos,https://www.aosfatos.org/noticias/vorcaro-delatou-mandante-atentado-bolsonaro/,falso,2026-04-28 07:00:00,https://encrypted-tbn1.gstatic.com/images?q=tbn:ANd9GcSbqMdMX7Kgb1_2HcyGlYFNQ8OuUifBFw76CZ4rYSWicI_x6rz2,"['Daniel Vorcaro', 'Jair Bolsonaro', 'Delação premiada', 'Atentado contra Jair Bolsonaro', '2018']"
Juíza corajosa desafia Moraes e manda libertar Jair Bolsonaro,UOL Notícias,https://noticias.uol.com.br/confere/ultimas-noticias/2026/04/27/falso-juiza-mandou-libertar-jair-bolsonaro.ghtm,Falso,2026-04-27 07:00:00,https://encrypted-tbn1.gstatic.com/images?q=tbn:ANd9GcT3egCaCvW22cuNbj1zFB0er0RwXotjb3VE3UI3GnDduAy7S7Vz,"['Jair Bolsonaro', 'Alexandre de Moraes', 'Juiz']"
Vídeos de personalidades públicas brasileiras criticando Bolsonaro,AFP Checamos,https://checamos.afp.com/doc.afp.com.A96M7KE,Falso,2026-04-27 07:00:00,https://encrypted-tbn3.gstatic.com/images?q=tbn:ANd9GcSAY8y-Xo-zXChmmRHqvi7wrjwnA-tctGlY27bwbsNGskQ9r8xG,"['Jair Bolsonaro', 'Vídeo', 'Brasil', 'Personalidade']"
Polícia Federal concluí que troca de mensagens entre Flávio Bolsonaro e Daniel Vorcaro não apresenta indícios de crime,UOL Notícias,https://noticias.uol.com.br/confere/ultimas-noticias/2026/05/19/falso-pf-conclusao-audio-crime-flavio-bolsonaro-daniel-vorcaro.ghtm,Falso,2026-05-19 07:00:00,https://encrypted-tbn2.gstatic.com/images?q=tbn:ANd9GcRK-FETjK-fbYUGQBh4yofNLoccZbd8FCJEOLUZEOKrSuUMVx-3,"['Flávio Bolsonaro', 'Daniel Vorcaro', 'Polícia Federal', 'Departamento de Polícia Federal', 'Crime', 'Polícia', 'Mensagem']"
Juíza desafia Moraes e ordena soltura de Jair Bolsonaro,Aos Fatos,https://www.aosfatos.org/noticias/juiza-mandou-soltar-bolsonaro/,falso,2026-04-24 07:00:00,https://encrypted-tbn0.gstatic.com/images?q=tbn:ANd9GcQA_0sF4z0-_vG7yqIsC-7XKq-iFGP9IsD4EpZCIZEitzUWJhWe,"['Jair Bolsonaro', 'Juiz', 'Alexandre de Moraes']"
Ulysses Guimarães critica Bolsonaro em 1988,AFP Checamos,https://checamos.afp.com/doc.afp.com.A8FJ8T4,Falso,2026-04-20 07:00:00,https://encrypted-tbn3.gstatic.com/images?q=tbn:ANd9GcSPbEs6ZqfacfbO2nrraxUSIcjSQbFbZR6HbTkaokpRrYsj3U5G,"['Ulysses Guimarães', 'Jair Bolsonaro', '1988']"
Bolsonaro não usou cartões corporativos enquanto era presidente,Aos Fatos,https://www.aosfatos.org/noticias/bolsonaro-cartao-corporativo/,falso,2026-04-17 07:00:00,https://encrypted-tbn0.gstatic.com/images?q=tbn:ANd9GcQTa-KE85INpunnEVHExqd9-c0jwuBqUiatcrfYmqqFXw_bH1En,"['Jair Bolsonaro', 'Cartão de visita', 'Presidente']"
Em 1988 Raul Seixas se assusta com Bolsonaro,AFP Checamos,https://checamos.afp.com/doc.afp.com.A8472T3,Falso,2026-04-16 07:00:00,https://encrypted-tbn2.gstatic.com/images?q=tbn:ANd9GcRgIrOn-W5jCww5tiap6V7P-Bez2PWDo02vlWxItxnKAq6tOhov,"['Raul Seixas', 'Jair Bolsonaro', '1988']"
Paulo Guedes disse que Bolsonaro dependia dos filhos para aprovar tudo na Presidência,Aos Fatos,https://www.aosfatos.org/noticias/guedes-bolsonaro-nao-mandava-em-nada/,falso,2026-04-15 07:00:00,https://encrypted-tbn2.gstatic.com/images?q=tbn:ANd9GcQ3ufVd2yGWfl2Yi14j5r-kuiUbMplr7pDOsv8AHO4fQqqU-kVF,"['Paulo Guedes', 'Jair Bolsonaro', 'Presidente do Brasil', 'Filho']"
Alexandre Frota confessa que foi namorado de Bolsonaro por dois anos o artista pornográfico era namorado de Bolsonaro,UOL Notícias,https://noticias.uol.com.br/confere/ultimas-noticias/2026/04/15/falso-alexandre-frota-namorou-jair-bolsonaro.ghtm,Falso,2026-04-15 07:00:00,https://encrypted-tbn1.gstatic.com/images?q=tbn:ANd9GcSNIoBGRaGK7MThF5k1fQHStPjO9Vi77X6JFbPZy4UlLnWdb_4y,"['Alexandre Frota', 'Jair Bolsonaro', 'Namoro', 'Artista', 'Pornográfico']"
Alexandre Frota confessou ter namorado Jair Bolsonaro por dois anos,Estadão,https://www.estadao.com.br/estadao-verifica/alexandre-frota-namorou-bolsonaro-enganoso/,Enganoso,2026-04-15 07:00:00,https://encrypted-tbn0.gstatic.com/images?q=tbn:ANd9GcQ4CAI2KOCJzP7B9C_6xHzXfYCifiyzKzeIPb_bAO5ILqANhD90,"['Alexandre Frota', 'Jair Bolsonaro', 'Namoro']"
"Paulo Guedes diz que Bolsonaro não mandava na presidência e dependia dos filhos Eduardo e Flávio para aprovar tudo. Guedes diz que “cansava de reclamar que os filhos queriam colocar o dinheiro dos negócios junto com o Queiroz no orçamento secreto, sendo que o presidente Bolsonaro não sabia de nada”.",Estadão,https://www.estadao.com.br/estadao-verifica/video-paulo-guedes-filhos-bolsonaro-mandavam-presidencia-ia-falso/,Falso,2026-04-14 07:00:00,https://encrypted-tbn2.gstatic.com/images?q=tbn:ANd9GcTsMbeP_lcBBjzgp7kgFurAPwZarSUpnc7HNNijYP3KAT-9XM8K,"['Jair Bolsonaro', 'Paulo Guedes', 'Flávio Bolsonaro', 'Orçamento secreto', 'Presidente do Brasil', 'Presidente', 'Eduardo Bolsonaro', 'Negócios']"
Band foi pressionada a demitir comentarista após ele criticar o conluio entre o STF e a PGR contra Bolsonaro,Estadão,https://www.estadao.com.br/estadao-verifica/band-demite-comentarista-stf-bolsonaro-falso/,Falso,2026-04-13 07:00:00,https://encrypted-tbn2.gstatic.com/images?q=tbn:ANd9GcQwYGhF4YD3X2SWam8l1vcGMPu2xtPElyP-DkNe_QGabhbmAzhx,"['Band', 'Procurador-Geral da República', 'Supremo Tribunal Federal', 'Comentarista', 'Jair Bolsonaro', 'Demissão', 'Conluio']"
Flávio prometeu “auxílio sacolão de ossos” caso seja eleito,Aos Fatos,https://www.aosfatos.org/noticias/flavio-bolsonaro-auxilio-sacolao-osso/,falso,2026-05-06 07:00:00,https://encrypted-tbn2.gstatic.com/images?q=tbn:ANd9GcR1s52V4Ep1YrRUuyTotVzDtoeRgnNZ1tgH2LZ80517rVW1ntV1,"['Flávio Bolsonaro', 'Osso', 'Eleição']"
Gonzaguinha critica Bolsonaro em 1990,AFP Checamos,https://checamos.afp.com/doc.afp.com.A7F44KE,Falso,2026-04-10 07:00:00,https://encrypted-tbn0.gstatic.com/images?q=tbn:ANd9GcSKsGnqwO7gR22Tsdns5vsbQ6AkqxZhOwiblDW4XR17rFKtT-7R,"['Jair Bolsonaro', 'Gonzaguinha']"
A Polícia Federal pede a prisão do Alexandre de Moraes por fraudar Documentos falsos contra o Jair messias Bolsonaro.,UOL Notícias,https://noticias.uol.com.br/confere/ultimas-noticias/2026/04/10/falso-pf-pedido-prisao-alexandre-de-moraes.ghtm,Falso,2026-04-10 07:00:00,https://encrypted-tbn2.gstatic.com/images?q=tbn:ANd9GcQXrwuSxYdoy9yhUzVpBCD0ZWHawQ09LXTFTh_lI2rtd8Af265z,"['Alexandre de Moraes', 'Polícia Federal', 'Jair Bolsonaro', 'Departamento de Polícia Federal', 'Fraude', 'Prisão', 'Documento', 'Polícia']"
Ludmilla denuncia Jair Bolsonaro por caso de racismo,AFP Checamos,https://checamos.afp.com/doc.afp.com.A7BB8WE,Falso,2026-04-09 07:00:00,https://encrypted-tbn1.gstatic.com/images?q=tbn:ANd9GcQ36pWM1X5_RILCDol98rHmJ50xCgvjfN6EvskCMHC_8HZAcaWn,"['Jair Bolsonaro', 'Ludmilla', 'Racismo', 'Denúncia']"
Em 1988 Renato Russo já dava alerta sobre Bolsonaro,BOL - UOL,https://www.bol.uol.com.br/noticias/2026/04/07/falso-videos-renato-russo-cazuza-gonzaguinha-critica-jair-bolsonaro.ghtm,Falso,2026-04-07 07:00:00,https://encrypted-tbn0.gstatic.com/images?q=tbn:ANd9GcT_HeInrJpJ3olEwPrVyOT8YMWZVCZ7cYy8RJrfOsL9XKRpbwF6,"['Renato Russo', 'Jair Bolsonaro', '1988']"
"PF pediu prisão de Moraes, que fraudou documentos contra Jair Bolsonaro",Aos Fatos,https://www.aosfatos.org/noticias/e-falso-que-pf-pediu-prisao-de-moraes-por-fraude-documental-contra-bolsonaro/,falso,2026-04-06 07:00:00,https://encrypted-tbn2.gstatic.com/images?q=tbn:ANd9GcQ7esHfltavBnUzdxY8FL3IqGYfURDVRXkGFcdWTBlg5nQfdjDl,"['Alexandre de Moraes', 'Jair Bolsonaro', 'Departamento de Polícia Federal', 'Polícia Federal', 'Prisão', 'Documento']"
Personalides como Renato Russo alertaram no passado sobre perigo que Bolsonaro representava,Estadão,https://www.estadao.com.br/estadao-verifica/videos-usam-ia-para-criar-alertas-de-gonzaguinha-renato-russo-e-cazuza-sobre-bolsonaro/,Falso,2026-04-06 07:00:00,https://encrypted-tbn2.gstatic.com/images?q=tbn:ANd9GcS7QaaJXADscfTFv4dwIqlWv57sDRjiHazuVSvwai8Wn1AtCXu4,"['Jair Bolsonaro', 'Renato Russo']"
Vídeo mostra Bolsonaro e Michelle comemorando prisão domiciliar em 2026,AFP Checamos,https://checamos.afp.com/doc.afp.com.A6LU69F,Falso,2026-04-02 07:00:00,https://encrypted-tbn0.gstatic.com/images?q=tbn:ANd9GcQjEfzoc1L4LGAQ8IHmlEuRn-mIPcW4Hs0SoeVFyW55FfCXwLyT,"['Jair Bolsonaro', 'Michelle Bolsonaro', 'Prisão domiciliar', 'Prisão', '2026', 'Vídeo']"
Trump disse que vai prender Lula e libertar Jair Bolsonaro,Aos Fatos,https://www.aosfatos.org/noticias/video-dublagem-falsa-trump-lula/,falso,2026-03-31 07:00:00,https://encrypted-tbn0.gstatic.com/images?q=tbn:ANd9GcRbAn2EuAevLKij23limHeK8Q7LTgyrXv_EEN7FDmtddTdNrZoo,"['Donald Trump', 'Luiz Inácio Lula da Silva', 'Jair Bolsonaro']"
Jair Bolsonaro sai do hospital em pé acenando para apoiadores,Estadão,https://www.estadao.com.br/estadao-verifica/bolsonaro-acena-alta-hospital-enganoso-2025/,Enganoso,2026-03-30 07:00:00,https://encrypted-tbn3.gstatic.com/images?q=tbn:ANd9GcSu9T8wwHb26hWtCD6GUlUE6CqFcBrgvQ-N1czjZkRZ4UrCZ3xQ,"['Jair Bolsonaro', 'Hospital']"
A situação clínica do ex-presidente acaba de se agravar e informações de bastidores sugerem uma tentativa de eliminação física por agentes patogénicos colocados na sua cela,Observador,https://observador.pt/factchecks/fact-check-jair-bolsonaro-foi-envenenado-com-chumbo-dentro-da-prisao/,Errado,,https://encrypted-tbn3.gstatic.com/images?q=tbn:ANd9GcSPoSTekUtgc_77fQoKLZVgRXrfRC2VlIfGvKU-4cRTmZlv5x96,"['Presidente', 'Informação', 'Agente patogénico']"
"Jair Bolsonaro (PL) mente sobre seu estado de saúde, pois deixou hospital caminhando e acenando",Aos Fatos,https://www.aosfatos.org/noticias/video-em-que-bolsonaro-sai-de-hospital-andando-e-de-2025/,falso,2026-03-26 07:00:00,https://encrypted-tbn2.gstatic.com/images?q=tbn:ANd9GcTAoAbAB-ecxDjnrx-tSZfKgELBuf6ulJ2vEsDPxWL_oEnStXvU,"['Jair Bolsonaro', 'Hospital', 'Partido Liberal', 'Saúde', 'Mente']"
"Governo de Jair Bolsonaro conseguiu segurar o preço da gasolina e entregá-la a R$ 4,88 em meio a guerra da Ucrânia, quando o valor do barril do petróleo chegou a custar US$ 141,00.",Estadão,https://www.estadao.com.br/estadao-verifica/preco-gasolina-brasil-inicio-guerra-ucrania-bolsonaro/,Enganoso,2026-03-25 07:00:00,https://encrypted-tbn1.gstatic.com/images?q=tbn:ANd9GcRlp7U66n7DANEIpISTquuwjW557okyFlTdAM5eikmK61fgAlmH,"['Jair Bolsonaro', 'Gasolina', 'Ucrânia', 'Estados Unidos', 'Guerra', 'Petróleo', 'Barril']"
Vídeo mostra Bolsonaro deixando UTI do hospital,Estadão,https://www.estadao.com.br/estadao-verifica/video-em-que-bolsonaro-circula-em-corredor-de-hospital-foi-feito-apos-cirurgia-em-2025-nao-agora/,Enganoso,2026-03-25 07:00:00,https://encrypted-tbn2.gstatic.com/images?q=tbn:ANd9GcTmHjTzqNzmomPAXxeJaBT8IRBt17RaJKPSUManrgBuJOMDgAIA,"['Jair Bolsonaro', 'Hospital', 'Vídeo', 'Unidade de terapia intensiva']"
"Esposa do médico de Jair Bolsonaro publicou foto em que ex-presidente aparece em pé e sorridente no quarto do hospital DF Star, em Brasília, após receber alta da UTI",Aos Fatos,https://www.aosfatos.org/noticias/foto-que-mostra-bolsonaro-em-pe-e-sorridente-no-hospital-nao-e-atual/,falso,2026-03-25 07:00:00,https://encrypted-tbn1.gstatic.com/images?q=tbn:ANd9GcSDtnO8kKLz-n7h0LHEn7jNZIJZZ4M33Qt2rSzut_QGTzDS6eZh,"['Jair Bolsonaro', 'Hospital', 'Presidente', 'Fotografia', 'Medicina', 'Unidade de terapia intensiva', 'Brasília', 'Quarto']"
"Cena mostra Jair Bolsonaro caminhando após receber alta da UTI e ser transferido para um quarto no hospital DF Star, em Brasília",Aos Fatos,https://www.aosfatos.org/noticias/video-bolsonaro-caminhando-hospital-2025-nao-atual/,não_é_bem_assim,2026-03-24 07:00:00,https://encrypted-tbn2.gstatic.com/images?q=tbn:ANd9GcQ2F7S0IDMEbFYqV_c4jATfvCuHp1HohpaLj_DndN9qVtjERKJx,"['Jair Bolsonaro', 'Hospital', 'Unidade de terapia intensiva', 'Brasília', 'Quarto']"
BOLSONARO APARECE NA UTI EM VÍDEO DIVULGADO POR CARLOS BOLSONARO.,UOL Notícias,https://noticias.uol.com.br/confere/ultimas-noticias/2026/03/24/falso-video-bolsonaro-internado-uti-pneumonia.ghtm,Distorcido,2026-03-24 07:00:00,https://encrypted-tbn1.gstatic.com/images?q=tbn:ANd9GcSfJ4Cx5OFjwvqWCviiZ66ti46SH_7mSruQu3Dn4ZJdWHKqc3fb,"['Jair Bolsonaro', 'Vídeo', 'Carlos Bolsonaro', 'Unidade de terapia intensiva']"
